{
  "schema": "runtime-validation-receipt",
  "receipt_id": "runtime_receipt_camera_probe_demo",
  "check_type": "camera_probe",
  "started_at": "2026-05-24T12:00:00Z",
  "completed_at": "2026-05-24T12:00:02Z",
  "status": "pass",
  "target": "tapo_living_room",
  "command": "apps/caresight-hub/scripts/caresight_camera_probe.py --config apps/caresight-hub/config/tapo.local.json",
  "result": {
    "first_frame_received": true,
    "redacted_uri": "rtsp://***:***@192.168.1.50:554/stream1"
  },
  "safety_boundaries": ["local_probe_only", "redacted_output", "no_live_send", "no_facetime_call", "no_tts_playback"],
  "blockers": [],
  "next_check_after": "2026-05-24T12:15:00Z"
}
