{
  "schema": "runtime-validation-receipt",
  "receipt_id": "runtime_receipt_heartbeat_demo",
  "check_type": "heartbeat",
  "started_at": "2026-05-24T12:00:00Z",
  "completed_at": "2026-05-24T12:00:01Z",
  "status": "warn",
  "target": "local demo stack",
  "command": "python apps/caresight-hub/scripts/caresight_demo_preflight.py --heartbeat --json",
  "result": {
    "camera_health": "not_attempted",
    "gemma_endpoint": "not_ready",
    "database": "present"
  },
  "safety_boundaries": ["no_live_send", "no_facetime_call", "no_tts_playback", "local_probe_only"],
  "blockers": [],
  "next_check_after": "2026-05-24T12:15:00Z"
}
